<?xml version="1.0" encoding="UTF-8"?>
<!ELEMENT lookuptable (row+)>
<!ELEMENT row (item+)>
<!ELEMENT item (#PCDATA)>
<!ELEMENT item (loc+)>
<!ATTLIST lookuptable
	name CDATA #REQUIRED
>

<!ELEMENT loc (#PCDATA)>
<!ATTLIST loc
	language CDATA #REQUIRED
	comment CDATA #IMPLIED
>
