<?xml version="1.0" encoding="ISO-8859-1" ?>
<!DOCTYPE lookuptable SYSTEM "../encounter.dtd" >
<lookuptable name="Environments">
	<!-- Header -->
	<row>
		<item>Environment</item>
		<item>File</item>
	</row>  
	        
	<row>
		<!-- Environment -->
		<item>Level 1 Dungeon<loc language="fr">Donjon niveau 1</loc></item>
		<!-- File -->
		<item>[environments/dungeon1]<loc language="fr">[environnements/donjon1]</loc></item>
	</row>  
	<row>
		<!-- Environment -->
		<item>Level 2 Dungeon<loc language="fr">Donjon niveau 2</loc></item>
		<!-- File -->
		<item>[environments/dungeon2]</item>
	</row>  


</lookuptable>