<?xml version="1.0" encoding="ISO-8859-1" ?>
<!DOCTYPE lookuptable SYSTEM "../encounter.dtd" >
<lookuptable name="table 4-14 Modified Die Roll">
	<!-- Multiplier -->
	<row>
		<item>die roll</item>
		<item>1/3</item>
		<item>1/2</item>
		<item>2/3</item>
		<item>3/2</item>
		<item>2</item>
		<item>3</item>
		<item>4</item>
	</row>
	
	<!-- Die roll 1 -->
	<row>
		<item>1</item>
		<item>1</item>
		<item>1</item>
		<item>1</item>
		<item>1d2</item>
		<item>1d3</item>
		<item>1d3+1</item>
		<item>1d4+2</item>
	</row>	

	<!-- Die roll 1d2 -->
	<row>
		<item>1d2</item>
		<item>1</item>
		<item>1</item>
		<item>1</item>
		<item>1d3</item>
		<item>1d3+1</item>
		<item>1d4+2</item>
		<item>1d6+3</item>
	</row>	
	
	<!-- Die roll 1d3 -->
	<row>
		<item>1d3</item>
		<item>1</item>
		<item>1</item>
		<item>1d2</item>
		<item>1d3+1</item>
		<item>1d4+2</item>
		<item>1d6+3</item>
		<item>1d6+5</item>
	</row>	
	
	<!-- Die roll 1d3+1 -->
	<row>
		<item>1d3+1</item>
		<item>1</item>
		<item>1d2</item>
		<item>1d3</item>
		<item>1d4+2</item>
		<item>1d6+3</item>
		<item>1d6+5</item>
		<item>1d4+10</item>
	</row>		

	<!-- Die roll 1d4+2 -->
	<row>
		<item>1d4+2</item>
		<item>1d2</item>
		<item>1d3</item>
		<item>1d3+1</item>
		<item>1d6+3</item>
		<item>1d6+5</item>
		<item>1d4+10</item>
		<item>Table 4-14</item>
	</row>	

	<!-- Die roll 1d6+3 -->
	<row>
		<item>1d6+3</item>
		<item>1d3</item>
		<item>1d3+1</item>
		<item>1d4+2</item>
		<item>1d6+5</item>
		<item>1d4+10</item>
		<item>Table 4-14</item>
		<item>Table 4-14</item>
	</row>	

	<!-- Die roll 1d6+5 -->
	<row>
		<item>1d6+5</item>
		<item>1d3+1</item>
		<item>1d4+2</item>
		<item>1d6+3</item>
		<item>1dd4+10</item>
		<item>Table 4-14</item>
		<item>Table 4-14</item>
		<item>Table 4-14</item>
	</row>	
</lookuptable>